formatted_article,nepali_summary
"अखिल नेपाल फुटबल संघ (एन्फा) ले राष्ट्रिय टोलीको प्रशिक्षण क्याम्प रद्द गर्ने निर्णय गरेको छ । 'ए' डिभिजनक्लबले लिग नसकिएसम्म राष्ट्रिय टोलीका खेलाडीलाई बन्द प्रशिक्षणका लागि रिलिज नगर्ने बताएपछि यस्तो घोषणा गरिएको हो । एन्फा र मुख्य प्रशिक्षक भिन्सेन्जो अल्बर्टो एनेसले साफ च्याम्पियनसिपको फाइनल छनोट गर्नुअघि बन्द प्रशिक्षण गर्ने तयारी गरेका थिए । एनेसले मंगलबार प्रतियोगिताका लागि प्रारम्भिक टोली छनोट गरेकी हुन् । अब जुन १० मा लिग सकिएपछि बन्द क्याम्प हुने भएको छ । साफ च्याम्पियनसिप जुन २१ देखि सुरु भए पनि नेपालले जुन १५ मा फिलिपिन्ससँग मैत्रीपूर्ण खेल खेल्नेछ । सन् २०२३ मा भारतको बेङ्लोरमा आयोजना हुने साफ च्याम्पियनसिपको समूह 'ए' मा नेपालले आयोजक भारत, कुवेत र पाकिस्तानसँग प्रतिस्पर्धा गर्दैछ । अर्को समूहमा लेबनान, माल्दिभ्स, भुटान र बंगलादेश छन् ।","अखिल नेपाल फुटबल संघ (एन्फा) ले 'ए' डिभिजन क्लबले लिग नसकिएसम्म बन्द प्रशिक्षणका लागि खेलाडी राख्न नमानेपछि राष्ट्रिय टोलीको प्रशिक्षण क्याम्प रद्द गरेको छ । जुन १० मा लिग सकिएपछि बन्द प्रशिक्षण हुनेछ । साफ च्याम्पियनसिप जुन २१ देखि सुरु भए पनि नेपालले जुन १५ मा फिलिपिन्ससँग मैत्रीपूर्ण खेल खेल्नेछ । साफ च्याम्पियनसिप२०२३ को समूह 'ए' मा नेपालले आयोजक भारत, कुवेत र पाकिस्तानसँग प्रतिस्पर्धा गर्दैछ ।"
मलेसियाको वाईएसडी–युकेएम ओभलमा जारी पाँच खेलको टी–ट्वान्टी क्रिकेट सिरिजको तेस्रो खेलमा नेपालले मलेसियालाई २७ रनले पराजित गरेको छ । जितसँगै नेपालले पाँच खेलको सिरिजमा २–१ को अग्रता लिएको छ ।  सोमबार भएको खेलमा नेपालले मलेसियालाई ५ विकेटले हराएको थियो भने मंगलबार मलेसियालाई ७ विकेटले पराजित गरेको थियो । यसअघि टस जितेर पहिले ब्याटिङ गरेको नेपालले ओपनर कविता कुँवरलाई सस्तैमा पवेलियन फर्काएको थियो । सीता रानामगर र ज्योति पाण्डेजस्ता ब्याट्सम्यानले इनिङसमाप्त गरे पनि इन्दु बर्मा र कप्तान रुबिना क्षेत्रीले २० ओभरमा १सय १० रन मात्र बनाउन सक्यो । जवाफमा नेपाली बलरले तीव्र गतिको विकेट लिनुका साथै रनरेटलाई नियन्त्रणमा राख्दा मलेसियाली महिला टोलीलाई पनि लयमा ल्याउन गाह्रो भएको थियो । मलेसियाले विकेट नगुमाए पनि निर्धारित दर कायम राख्न नसक्दा लक्ष्यभन्दा २७ रनले पछि परेको थियो । महिराह इज्जाती इस्माइलले ५४ बलमा ४४ रन को योगदान दिए । यी दुई टोलीले शनिबार खेल्नेछन् ।,मलेसियाको वाईएसडी–युकेएम ओभलमा भएको पाँच खेलको टी–ट्वान्टी सिरिजको तेस्रो खेलमा नेपालले २७ रनको जित निकाल्दै सिरिजमा २–१ को अग्रता लिएको छ । नेपाल सोमबार मलेसियासँग पाँच विकेटले र मंगलबार सात विकेटले पराजित भएको थियो । आयोजकले नेपाललाई पहिले ब्याटिङको निम्तो दिए पनि सीता रानामगर र ज्योति पाण्डेजस्ता ब्याट्सम्यान आउट भए । नेपाली बलरहरुले छिटो विकेट लिनुका साथै रन रेटलाई नियन्त्रणमा राख्न मलेसियाले निकै संघर्ष गर्नुप¥यो । महिराह इज्जाती इस्माइलले ५४ बलमा ४४ रन बनाए ।
"मलेसियाको वाईएसडी–युकेएम ओभलमा जारी पाँच खेलको टी–ट्वान्टी क्रिकेट सिरिजको दोस्रो खेलमा नेपालले मलेसियालाई ७ विकेटले पराजित गरेको छ । जितसँगै नेपालले पाँच खेलको सिरिज बराबरी गरेको छ ।  सोमबार भएको खेलमा नेपाल मलेसियासँग ५ विकेटले पराजित भएको हो । टस जितेर पहिले ब्याटिङ रोजेको आयोजकले सुस्त सुरुआत गरेको थियो । मलेसियन ब्याट्सम्यानले गेट–गोबाट संघर्ष गर्दा पनि गोल गर्न सकेनन् । पहिलो खेलमा ३१ रनको साझेदारी गरे पनि मलेसियाका ब्याट्सम्यानमाथि नेपाली बलरको दबदबा कायमै रहँदा आयोजकले महत्वपूर्ण अन्तरालमा विकेट गुमाइरहेको थियो । विकेट लिन नसके पनि नेपाली बलरले २० ओभरमा ९७ रन मात्र बनाउन सक्यो । बलिङतर्फ रुबिना क्षेत्रीले एक तथा इन्दु बर्मा र कविता कुँवरले एक–एक विकेट लिए । जवाफमा कुँवर, सीता रानामगर र क्षेत्रीले १५ बल बाँकी छँदै जित हात पारेका थिए । तेस्रो टी–२० खेल जुन १ मा हुनेछ ।","मलेसियाको वाईएसडी–युकेएम ओभलमा भएको दोस्रो टी–ट्वान्टी खेलमा नेपालले मलेसियालाई पराजित गर्दै पाँच खेलको सिरिज बराबरीमा ल्याएको हो । आयोजकले सुरुदेखि नै संघर्ष गर्दै महत्वपूर्ण अन्तरालमा विकेट गुमाएको थियो । टस हारेर पहिले ब्याटिङ गरेको नेपाली बलरले निर्धारित २० ओभरमा ९७ रन मात्र बनाउन सक्यो । बलिङतर्फ रुबिना क्षेत्रीले विकेट लिँदा इन्दु बर्मा र कविता कुँवरले समान १–१ विकेट लिए । कुँवर, सीता रानामगर र क्षेत्रीको अर्धशतकीय इनिङ्सको मद्दतमा नेपालले १५ बल बाँकी छँदै जित हात पारेको हो ।"
"राष्ट्रिय खेलकुद परिषद् (राखेप) को कभर्डहलमा आइतबार भएको काभा महिला भलिबलमा नेपालले उज्बेकिस्तानलाई तीन–एक सेटमा पराजित गर्दै तेस्रो स्थान हासिल गरेको हो । आयोजक तथा डिफेन्डिङ च्याम्पियन नेपालले उज्बेकिस्तानलाई २०–२५, २५–१६, २५–१५ र २५–१३ ले पराजित गर्दै कास्य पदक जितेको हो । यी दुईले सन् २०२१ मा काभा महिला भलिबलको फाइनलमा भेट गरेका थिए । नेपाल सेमिफाइनलमा एसियाली भलिबल क्लब कजाखस्तानसँग कडा प्रतिस्पर्धामा पराजित भएको थियो भने भारतले उज्बेकिस्तानलाई पराजित गरेको थियो । फाइनलमा भारत र कजाखस्तान बीच प्रतिस्पर्धा हुनेछ ।","उज्बेकिस्तानलाई तीन–एक सेटमा पराजित गर्दै नेपालले काभा महिला भलिबलको उपाधि जितेको हो । आयोजक र डिफेन्डिङ च्याम्पियनले कास्य पदक २०–२५, २५–१६, २५–१५ र २५–१३ ले जिते । सेमिफाइनलमा नेपाल कजाकिस्तानसँग पराजित भएको थियो भने भारतले उज्बेकिस्तानलाई हराएको थियो ।"
"नेपाल क्रिकेट सङ्घ (क्यान)ले जिम्बाब्वेमा हुने विश्वकप छनोटको पूर्वसन्ध्यामा राष्ट्रिय टोलीमाथि अन्यायपूर्ण व्यवहार भएको भन्दै अन्तर्राष्ट्रिय क्रिकेट परिषद् (आइसिसी) लाई पत्र लेखेको छ । आइसिसीको तालिकाअनुसार नेपालले टेस्ट राष्ट्रसँग अभ्यास खेल खेल्न पाउने छैन । उसले एसोसिएट राष्ट्र ओमान र युएईसँग अभ्यास खेल खेल्दैछ । विश्वकप छनोटमा सहभागी अन्य सबै एसोसिएट राष्ट्रले टेस्ट राष्ट्रसँग कम्तीमा एक खेल खेलिरहेका छन् । ""हामीलाई लाग्छ कि यो अनुचित छ। हामीले उनीहरूलाई पत्र लेख्यौं र आइसिसीलाई टेस्ट राष्ट्रविरुद्ध कम्तीमा एक म्याचका लागि अनुरोध गर्यौं। उनीहरूले कुनै जवाफ दिएका छैनन्,' क्यानका सचिव दुर्गा पाठकले भने। नेपालले जुन १३ मा युएई र जुन १५ मा ओमानसँग अभ्यास खेल खेल्नेछ । नेदरल्यान्ड्स, स्कटल्यान्ड र अमेरिकाजस्ता एसोसिएट टोलीले टेस्ट राष्ट्रविरुद्ध दुई खेल खेलिरहेका छन् भने ओमान र युएईले टेस्ट राष्ट्रविरुद्ध एक–एक खेल खेलिरहेका छन् ।",नेपाल क्रिकेट संघ (क्यान) ले जिम्बाब्वेमा हुने विश्वकप छनोटको पूर्वसन्ध्यामा अन्तर्राष्ट्रिय क्रिकेट परिषद् (आइसिसी)ले राष्ट्रिय टोलीमाथि अन्याय गरेको भन्दै आलोचना गरेको छ । आइसिसीको तालिकामा नेपालले टेस्ट राष्ट्रसँग अभ्यास खेल नखेल्ने तर ओमान र युएईसँग अभ्यास खेल खेल्ने उल्लेख छ । क्यानले टेस्ट राष्ट्रविरुद्ध कम्तीमा एक खेलका लागि आइसिसीलाई अनुरोध गरे पनि आइसिसीले कुनै प्रतिक्रिया दिएको छैन ।
"जिम्बावेमा हुने आइसिसी विश्वकप छनोटअघि टेस्ट राष्ट्रसँग अभ्यास खेल नखेल्ने नेपाल एक मात्र टोली हो । आइसिसीको तालिकाअनुसार नेपालले वेस्ट इन्डिज र जिम्बाब्वेजस्ता टेस्ट टोलीसँग खेल्ने तयारीस्वरुप एसोसिएट राष्ट्र ओमान र युएईसँग खेल्नेछ । यसको अर्थ यो हो कि टोलीले प्रतियोगिताको उत्कृष्ट टोलीसँग आफूलाई परीक्षण गर्न सक्षम हुनेछैन र आइसिसी पुरुष क्रिकेट लिग २ मा खेलेका दुई टोलीविरुद्ध खेल्नु पर्नेछ र हालै सम्पन्न एसीसी पुरुष प्रिमियर कपमा आरामसँग पराजित भएर एसिया कपमा स्थान पक्का गर्नुपर्नेछ। समूह 'ए' मा नेपालले आयोजक जिम्बावे, पूर्वविश्व विजेता वेस्ट इन्डिज, नेदरल्यान्ड्स र अमेरिकासँग प्रतिस्पर्धा गर्नेछ । नेपालले पहिलो पटक वेस्ट इन्डिजको सामना गर्दैछ ।",जिम्बाब्वेमा हुने आइसिसी विश्वकप छनोटअघि नेपालले टेस्ट राष्ट्रसँग अभ्यास खेल खेल्ने छैन । वेस्ट इन्डिज र जिम्बाब्वेविरुद्धको टेस्ट म्याचको तयारीका लागि उसले ओमान र युएईसँग खेल्नेछ । यसको अर्थ आइसिसी पुरुष क्रिकेट लिग–२ र एसिसी मेन्स प्रिमियर कपमा पराजित भइसकेको नेपालले प्रतियोगिताको उत्कृष्ट टोलीसँग परीक्षण गर्नुपर्नेछ ।
"अखिल नेपाल फुटबल संघ (एन्फा) ले सन् २०२४ मा कतारमा आयोजना हुने यू–२३ एसियन कपको छनोट चरणका लागि टोली नपठाउने निर्णय गरेको छ । एन्फाका प्रवक्ता सुरेश शाहले छनोटमा टोली पठाउन एन्फाले रकम नचाहेकाले यस्तो निर्णय गरिएको बताए । उनले आफ्नो वार्षिक योजनामा प्रतियोगितामा सहभागिता नसमावेश गरिएको पनि बताए । 'हाम्रो प्राथमिकता राष्ट्रिय टोली हो र हामी यो सुनिश्चित गर्न चाहन्छौं कि टोली अक्टोबरमा हुने विश्वकप छनोटका लागि तयार छ,' उनले भने। 'हामीसँग यस वर्ष यु–२३ कार्यक्रमका लागि बजेट र योजना थिएन। यो ए डिभिजनमा खेल्ने धेरै यू-२३ खेलाडीहरूको लागि निराशाको रूपमा आउँछ। राष्ट्रिय टोलीका मुख्य प्रशिक्षक भिन्सेन्जो अल्बर्टो एनेसले पनि नेपाली युवा फुटबलरलाई एक्सपोजर दिनुपर्ने माग गर्दै आएकाले उनी पनि यसबाट निराश हुनेछन् ।",अखिल नेपाल फुटबल संघ (एन्फा) ले सन् २०२४ मा कतारमा आयोजना हुने यू–२३ एसियन कप छनोट मा नेपाली टोली नपठाउने निर्णय गरेको छ । आर्थिक अभाव र एन्फाको वार्षिक योजनामा समावेश हुन नसकेका कारण यस्तो निर्णय गरिएको हो । यो निर्णयले ए डिभिजनका धेरै यू–२३ खेलाडी र नेपाली युवा फुटबलरका लागि एक्सपोजरको वकालत गर्दै आएका मुख्य प्रशिक्षक भिन्सेन्जो अल्बर्टो एनेसका लागि निराशाजनक भएको छ ।
"आयोजक नेपाल र भारत काभा महिला भलिबल च्यालेन्ज कप २०२३ को सेमिफाइनलमा प्रवेश गरेका छन् । समूह 'ए' अन्तर्गत मंगलबार भएको खेलमा नेपाल र भारतले सहज जित हात पारेका छन् । राष्ट्रिय खेलकुद परिषद् (राखेप) को कभर्डहलमा मंगलबार भएको खेलमा नेपालले बंगलादेशलाई २५–१०, २५–८, २५–९ ले तथा भारतले किर्गिस्तानलाई २५–१७, २५–८, २५–८ ले पराजित गरेको हो । नेपालका लागि कविता भट्ट, प्रगति नाथ, पूजा चौधरी र शान्तिकला तामाङले बंगलादेशविरुद्ध तथा संगम महतो र रिमा कुँवरले किर्गिस्तानविरुद्ध डेब्यु गरेका थिए । सोमबार भएको खेलमा नेपालले किर्गिस्तानलाई हराएको थियो भने भारतले बंगलादेशलाई सोझो सेटमा हराएको थियो । समूह 'ए' को शीर्ष स्थानमा रहेको नेपाल र भारतबीच बुधबार प्रतिस्पर्धा हुनेछ । विजेताले सेमिफाइनलमा एसियाली भलिबल क्लब कजाखस्तानको सामना गर्नेछ । कजाखस्तान समूह 'बी' को शीर्ष स्थानमा रहने सम्भावना छ भने मध्य र दक्षिण एसियाका आठ टोलीले प्रतियोगितामा भाग लिनेछन् ।",नेपाल र भारतले समूह 'ए' को खेलमा बंगलादेश र किर्गिस्तानलाई पराजित गर्दै काभा महिला भलिबल च्यालेन्ज कप २०२३ को सेमिफाइनलमा प्रवेश गरेका छन् । नेपालले बंगलादेशविरुद्ध डेब्यु गरेको थियो भने भारतले किर्गिस्तानलाई सोझो सेटमा हराएको थियो । विजेताले बुधबार एकअर्कासँग प्रतिस्पर्धा गर्नेछ भने विजेताले सेमिफाइनलमा एसियाली भलिबल क्लब कजाखस्तानलाई पराजित गर्नेछ । प्रतियोगितामा मध्य र दक्षिण एसियाका ८ टिमको सहभागिता रहेको छ ।
