formatted_article,nepali_summary
"""अर्थमन्त्री जनार्दन शर्माले अघिल्लो सरकारले प्रतिनिधिसभा विघटन गरी अध्यादेशमार्फत घोषणा गरेको चालू आर्थिक वर्ष २०७७/७८ को बजेट योजनामा परिवर्तन गर्न प्रतिस्थापन विधेयक प्रस्तुत गर्ने बताएका छन् । प्रतिनिधिसभाको मंगलबारको बैठकमा राष्ट्रिय अर्थतन्त्रसम्बन्धी श्वेतपत्र प्रस्तुत गर्दै शर्माले गठबन्धन सरकारमा रहेका दलले यस विषयमा छलफल गर्ने र अध्यादेशका कमीकमजोरी सच्याउँदै प्रतिस्थापन विधेयक तयार पार्ने बताए । उनले नयाँ विधेयकले कोभिड–१९ संकट, जनसरोकारका साथै गठबन्धन दलले तय गरेको न्यूनतम साझा कार्यक्रमले सिर्जना गरेका चुनौतीलाई सम्बोधन गर्ने दाबी गरे ।  शर्माका अनुसार मुलुकको सरकारी सञ्चिति १ खर्ब ४३ अर्ब रुपैयाँ घाटामा छ । उनले अघिल्लो सरकारले राजस्वको स्रोतलाई ख्याल ै नगरी बजेटको आकार बढाएको भन्दै आलोचना गरे ।""","अर्थमन्त्री जनार्दन शर्माले प्रतिनिधिसभा विघटनपछि अघिल्लो सरकारले घोषणा गरेको आर्थिक वर्ष २०७७/७८ को बजेट योजनालाई संशोधन गर्न प्रतिस्थापन विधेयक प्रस्तुत गर्ने तयारी गरेका छन् । शर्माले कोभिड–१९ संकट, जनसरोकार र न्यूनतम साझा कार्यक्रमबाट उत्पन्न चुनौतीलाई सम्बोधन गर्न गठबन्धन सरकारले यस विषयमा छलफल गरी नयाँ विधेयक तयार पार्ने बताए । शर्माले अघिल्लो सरकारले राजस्वको स्रोतलाई ख्याल ै नगरी बजेट बढाएको भन्दै आलोचना गरे ।"
"""काठमाडौं महानगरपालिकाले स्वास्थ्य राज्यमन्त्री उमेश श्रेष्ठको जनमैत्री अस्पताल, चर्चित व्यवसायी अजेयराज सुमार्गीजस्ता नाम चलेका सम्पत्ति कर छलीगर्नेको नयाँ सूची सार्वजनिक गरेको छ । सरकारले आफ्नो नयाँ सूचनामा ५२ करदातालाई कर तिर्न ३० दिनको समयावधि दिएको छ । नेपाल विद्युत् प्राधिकरण, खाद्य व्यवस्था तथा व्यापार कम्पनी, राष्ट्रिय नाचघर, साझा भण्डार, कर्मचारी सञ्चयकोषलगायतका सरकारी संस्थानले पनि कर नतिरेका छन् । कामपा राजस्व विभागका प्रमुख शिवराज अधिकारीले सूचनाको वास्ता नगरे नगर सरकारले कुनै पनि कारोबारमा रोक लगाउने र नगर सरकारले दिने सेवा रोक्का गर्ने बताए । गत हप्ता शहरले कर छली गर्ने २० जनाको सूची सार्वजनिक गरेको थियो । प्रकाशनपछि धेरैले सम्बन्धित निकायमा सम्पर्क गरी पहिलो किस्ता बुझाएको अधिकारीले जानकारी दिए ।""","काठमाडौंले राज्यमन्त्री उमेश श्रेष्ठ, व्यवसायी अजेयराज सुमार्गीलगायत सम्पत्ति कर छली गर्नेको सूची सार्वजनिक गरेको छ । सरकारले ५२ करदातालाई कर तिर्न ३० दिनको समय दिएको छ । नेपाल विद्युत् प्राधिकरण, खाद्य व्यवस्था तथा व्यापार कम्पनी, राष्ट्रिय नाचघर, साझा भण्डार, कर्मचारी सञ्चय कोषजस्ता सरकारी संस्थानले पनि गैरकर तिर्ने गरेका छन् । कामपा राजस्व विभागका प्रमुख शिवराज अधिकारीले सम्पत्ति कारोबार र सरकारी सेवा अवरुद्ध हुने चेतावनी दिएका छन् ।"
"""नेपाली युवा उद्यमी मञ्च (एनवाईईएफ) को काठमाडौँ शाखाले आगामी सेप्टेम्बरमा आयोजना हुने तीन वटा अवार्डका लागि देशभरका स्टार्टअपबाट मनोनयन आह्वान गरेको छ । च्याप्टरले एनवाईईएफ केटीएम स्टार्टअप अवार्ड्स उत्साही र संचालित उद्यमीहरूको लागि एक प्रमुख प्रतियोगिता र बुट क्याम्प हो जसले आफ्नो स्टार्टअपलाई स्केलेबल व्यवसायमा पोषण गर्ने लक्ष्य राख्दछ। यो कार्यक्रम पाँच वर्षभन्दा कम समयदेखि बजारमा रहेका स्टार्टअपलाई लक्षित गरी आयोजना गरिएको हो ।  प्रतियोगितामा प्रथम र द्वितीय हुनेलाई रु एक लाख ५० हजार, दोस्रोहुनेलाई रु ७५ हजार तथा पिपुल्स च्वाइस अवार्डका लागि रु ५० हजार पुरस्कार प्रदान गरिने आयोजकले जनाएको छ । ""यस कार्यक्रममा एक गहन परामर्श कार्यक्रम समावेश हुनेछ जहाँ सहभागी व्यवसायहरूले न्यायाधीशहरूको प्यानलको अगाडि आफ्ना विचारहरू प्रस्तुत गर्नेछन्। उक्त परिच्छेदमा मनोनयनका लागि देहायबमोजिमको मापदण्ड निर्धारण गरिएको उल्लेख गरिएको छ ।""","काठमाडौंस्थित नेपाली युवा उद्यमी मञ्च (एनवाईईएफ) ले स्टार्टअपका लागि तीन वटा अवार्डका लागि मनोनयन माग गरेको छ । एनवाईईएफ केटीएम स्टार्टअप अवार्ड्स पाँच वर्षभन्दा कम उमेरका उद्यमीहरूका लागि प्रतिस्पर्धा र बुट क्याम्प हो। प्रतियोगितामा प्रथम र द्वितीय हुनेले रु एक लाख ५० हजार, दोस्रोहुनेले रु ७५ हजार तथा पिपुल्स च्वाइस अवार्डका लागि रु ५० हजार पुरस्कार प्राप्त गर्नेछन् । कार्यक्रममा इन्टेन्स मेन्टरसिप प्रोग्राम पनि समावेश हुनेछ ।"
"""नयाँ आर्थिक वर्ष शुरु भएको १८ दिन बितिसक्दा पनि मुलुकका ७५३ स्थानीय तहमध्ये ५१ स्थानीय तहले चालू आर्थिक वर्षको बजेट घोषणा गर्न सकेका छैनन् । अन्तरसरकारी वित्तीय व्यवस्था ऐनले प्रादेशिक बजेट वक्तव्यका लागि असार १ (जुन १५) र स्थानीय तहका लागि असार १० (जुन २४) को मिति तोकेको छ । संघीय मामिला तथा स्थानीय विकास मन्त्रालयका प्रवक्ता वसन्त अधिकारीका अनुसार ५९ वटा स्थानीय तहमध्ये ३६ वटाले बजेट ल्याउन सकेका छैनन् भने १५ वटाले नगरसभाबाट योजना पारित गर्न सकेका छैनन् । बजेट योजना प्रस्तुत गर्न असफल भएका इकाइहरूको प्रदेशगत वितरण तल दिइएको छ: यद्यपि ढिलाइले संघीय स्तरमा बजेट प्रणालीलाई पनि असर पार्छ, तर संघीय सरकारले त्यस्ता एकाइहरूलाई कारबाही गर्न सक्दैन किनकि तिनीहरू पनि स्वतन्त्र सरकारहरू हुन्, अधिकारीहरूको अनुसार।""","नयाँ आर्थिक वर्ष शुरु भएको १८ दिन बितिसक्दा पनि नेपालका ७५३ स्थानीय तहले चालू आर्थिक वर्षको बजेट सार्वजनिक गरेका छैनन् । अन्तरसरकारी वित्तीय व्यवस्था ऐनले प्रादेशिक बजेट विवरण र स्थानीय बजेटको समयावधि तोकेको छ, तर नयाँ वर्ष सुरु हुनुभन्दा २० दिनअगाडि । ५९ वटा मध्ये ३६ वटाले बजेट ल्याउन सकेका छैनन् भने १५ वटा स्थानीय तहले नगरसभाबाट पारित गर्न सकेका छैनन् । ढिलासुस्तीले संघीय बजेट प्रणालीलाई असर गर्छ, तर संघीय सरकारले यी स्वतन्त्र सरकारलाई कारबाही गर्न सक्दैन ।"
"""काठमाडौं– आगामी महिना नयाँ स्टार्टअप मिटिङ हुने भएको छ, जसमा देशभरका १०० भन्दा बढी स्टार्टअपको सहभागिता रहने आयोजकको दाबी छ । फाइब्रो नेपाल, सरलमाइन्ड, टेक साथी र आइडिया जारले संयुक्त रुपमा दोस्रो संस्करणको रिभ्याम्प नेपाल इभेन्टको आयोजना आगामी अगष्ट १३ देखि १४ सम्म भर्चुअल माध्यमबाट गर्ने भएका छन् । इभेन्टमा सहभागी स्टार्टअपहरुले आफ्ना ग्राहकहरुलाई उत्कृष्ट डिल र अफरहरु प्रदान गर्नेछन् ।  यसअघि महामारीका बीच सामाजिक सञ्जालको वातावरणलाई पुनर्जीवित गर्ने उद्देश्यले सन् २०२१ को फेब्रुअरी २७ मा रिभ्याम्प नेपाल आयोजना गरिएको थियो । रिभ्याम्प नेपाल २.० का लागि स्टार्टअप र ग्राहक दुवैका लागि दर्ता खुला गरिएको छ । दर्ता को लागि लिंक यहाँ छ।""","फिब्रो नेपाल, सरलमाइन्ड, टेक साथी र आइडिया जारले आयोजना गरेको 'रिभ्याम्प नेपाल इभेन्ट'को दोस्रो संस्करण यही साउन २८ देखि २८ गतेसम्म आयोजना हुने भएको छ । यस कार्यक्रमको उद्देश्य कोभिड–१९ महामारीबाट प्रभावित स्टार्टअप र व्यवसायहरूलाई पुनरुत्थान गर्न मद्दत गर्नु हो। सन् २०२१ को फेब्रुअरीमा पहिलो पटक आयोजना गरिएको यस कार्यक्रमको उद्देश्य सामाजिक सञ्जालको वातावरणलाई पुनर्जीवित गर्नु हो । रिभ्याम्प नेपाल २.० का लागि स्टार्टअप र ग्राहक दुवैका लागि दर्ता खुला गरिएको छ ।"
"""कम्पनी रजिष्ट्रारको कार्यालयले आर्थिक वर्ष २०७७/७८ मा विभिन्न क्षेत्रका केही ठूला कम्पनीसहित ३२ वटा कम्पनी निजी कम्पनीबाट पब्लिक कम्पनीमा रूपान्तरण भएको जनाएको छ । कार्यालयका प्रमुख प्रदीपराज अधिकारीका अनुसार अब कम्पनीले प्रारम्भिक सार्वजनिक निष्कासन (आइपिओ) र फलोअन पब्लिक अफर (एफपिओ) जारी गर्न सक्नेछन् ।  तल कम्पनीहरूको सूची हो जुन सार्वजनिक व्यक्तिहरूमा परिवर्तन भयो। तीमध्ये केही आ–आफ्नो क्षेत्रमा स्थापित छन् ।""","कम्पनी रजिष्ट्रारको कार्यालय, काठमाडौंले आर्थिक वर्ष २०७७/७८ मा विभिन्न क्षेत्रका केही ठूला कम्पनीसहित ३२ वटा कम्पनी पब्लिक कम्पनीमा रुपान्तरण भएको जनाएको छ । यी कम्पनीले अब प्रारम्भिक सार्वजनिक निष्कासन (आइपिओ) र फलोअन पब्लिक अफरिङ (एफपीओ) जारी गर्न सक्नेछन् ।"
"""मेलम्ची खानेपानी आयोजनामा गत असारमा आएको बाढीले करीब रु दुई अर्ब बराबरको क्षति पु¥याएको आयोजना व्यवस्थापन टोलीले अनुमान गरेको छ । आयोजनाका कार्यकारी निर्देशक रामकुमार श्रेष्ठका अनुसार प्रारम्भिक अनुमानअनुसार करिब रु एक अर्ब ८८ करोड बराबरको क्षति भएको छ । वास्तविक क्षतिको हिसाब किताब गर्न समय लाग्ने उनको भनाइ छ । उनले भने, 'पानीमा डुबेका सबै संरचनाको अध्ययन पछि हामी यकिन विवरण भन्न सक्छौं । अहिले हाम्रो प्राविधिक टोली मेलम्चीमा छ, बाँध मर्मतका लागि के गर्न सकिन्छ भनेर जाँचगर्न। नयाँ चरणको बाढीका कारण आयोजनाको जीर्णोद्धारमा असर परेको उनको गुनासो छ । सन् २०२२ को फेबु्रअरीअघि नै आयोजना सञ्चालनमा ल्याउन नसकिने आयोजनाको टोलीले बताइसकेको छ । सिन्धुपाल्चोकमा गत महिना आएको भीषण बाढीले आयोजनाका संरचनामा ठूलो क्षति पु¥याएपछि केही प्राविधिक कामका कारण दुई महिनादेखि रोकिएको खानेपानी आपूर्ति सुचारु हुन सकेको छैन । आयोजनाले गत चैतमा मात्र खानेपानी आपूर्ति सुरु गरेको थियो ।""",गत असारमा आएको बाढीले मेलम्ची खानेपानी आयोजनामा करिब रु दुई अर्ब बराबरको क्षति पु¥याएको थियो । आयोजनाका कार्यकारी निर्देशक रामकुमार श्रेष्ठका अनुसार करिब रु एक अर्ब ८८ करोड बराबरको क्षति भएको छ । सही हानि गणना गर्न समय लाग्नेछ। यो परियोजना सन् २०२२ को फेबु्रअरीअघि पुनः सञ्चालनमा ल्याउन सकिंदैन । सिन्धुपाल्चोकमा आएको बाढीले आयोजनाको पूर्वाधारमा ठूलो क्षति पु¥याएपछि प्राविधिक कामका लागि दुई महिनाका लागि खानेपानी आपूर्ति बन्द भएको थियो । यो परियोजना गत मार्चमा सुरु भएको थियो ।
"""सरकारले आर्थिक वर्ष २०७७/७८ का लागि तय गरेको वैदेशिक ऋण र वैदेशिक अनुदानको लक्ष्यको आधा पनि प्राप्त गर्न सकेको छैन । अर्थमन्त्रालयको प्रारम्भिक गणनाअनुसार सरकारले लक्षित वैदेशिक सहायताको ४५ प्रतिशत (ऋण र अनुदान दुवैसहित) मात्र प्राप्त गरेको अर्थसचिव शिशिरकुमार ढुङ्गानाले जानकारी दिए । उनका अनुसार सरकारले दुई खर्ब ९९ अर्ब रुपैयाँ वैदेशिक ऋण लिने लक्ष्य राखेकोमा एक खर्ब ३९ अर्ब रुपैयाँ प्राप्त गरेको छ । यस्तै ६० अर्ब रुपैयाँ अनुदान दिने लक्ष्य राखिएकोमा २४ अर्ब रुपैयाँ अनुदान प्राप्त भएको छ । अधिकांश सहयोग पूँजीगत खर्चमा केन्द्रित भए पनि सरकारले पुँजीगत बजेट खर्च गर्न निकै खराब काम गरेकाले अपेक्षाभन्दा निकै कम रकम प्राप्त भएको मन्त्रालयले विश्लेषण गरेको छ । वास्तविक पूँजीगत खर्च र लक्ष्यबीच रु एक खर्ब २४ अर्बको अन्तर रहेको छ ।""","अर्थ मन्त्रालयको प्रारम्भिक गणनाअनुसार नेपाल सरकारले आर्थिक वर्ष २०७७/७८ का लागि वैदेशिक ऋण र अनुदानलक्ष्यको आधा रकम पूरा गर्न सकेको छैन । सरकारले वैदेशिक ऋणबाट रु एक खर्ब ३९ अर्ब र अनुदानबाट रु २४ अर्ब प्राप्त गरेको छ, जुन लक्ष्यभन्दा रु दुई खर्ब ९९ अर्ब र रु ६० अर्बकम हो । वास्तविक पुँजीगत खर्च र लक्ष्यबीच १ खर्ब २४ अर्ब रुपैयाँको अन्तर रहेको सरकारले पुँजीगत खर्चमा ध्यान केन्द्रित गरेको छ ।"
"""काठमाण्डाै – नेपालको एक मात्र शेयर बजारमा आइतबार सबैभन्दा बढी अङ्कले वृद्धि भएको छ ।  नेपाल स्टक एक्सचेन्ज (नेप्से) परिसूचक बिहीबारको तुलनामा ९७.२१ अंकले बढेर २९८०.६१ अंकमा बन्द भएको छ ।  आइतबार बजारमा ११ अर्ब ६३ करोड रुपैयाँबराबरको कारोबार भएको छ ।  दोस्रो बजारका १३ वटै उपसूचकमा आज वृद्धि भएको छ । आज दोस्रो बजारमा २१७ कम्पनीका १२ करोड ३० लाख भन्दा बढीको शेयर कारोबार भएको छ ।""","आइतबार नेपालको शेयर बजार २९८०.६१ अंकमा बन्द भएको छ, जुन बिहीबारको तुलनामा ९७.२१ अंकले बढी हो । दोस्रो बजारमा कूल २१७ कम्पनीका १२ करोड ३० लाख भन्दा बढीको शेयर रु ११ अर्ब ६३ करोड ३० लाख बराबरको कारोवार भएको छ ।"
