formatted_article,nepali_summary
"""काठमाण्डाै – नेपालमा औद्योगिक प्रतिष्ठानको सङ्ख्या ६० हजार १८५ पुगेको सरकारले जनाएको छ । केन्द्रीय तथ्याङ्क विभागले ११औँ राष्ट्रिय औद्योगिक सर्वेक्षण, २०२० को प्रतिवेदन शुक्रबार काठमाडौँमा सार्वजनिक गरेको छ । कोभिड महामारीका कारण महिनौंसम्म सर्वेक्षण रोकिएकाले अनपेक्षित रूपमा ढिलो गरी प्रतिवेदन सार्वजनिक गरिएको ब्यूरोले जनाएको छ । विभागका निर्देशक विनोदशरण आचार्यका अनुसार कम्तीमा एउटा सरकारी निकायमा दर्ता भएका औद्योगिक प्रतिष्ठानलाई सर्वेक्षणमा समावेश गरिएको छ ।  तल सर्वेक्षण परिणामको अन्य विवरणहरू छन्।""","केन्द्रीय तथ्याङ्क विभागले कोभिड महामारीका कारण अनपेक्षित रुपमा ढिलो गरी शुरु गरिएको ११औँ राष्ट्रिय औद्योगिक सर्वेक्षण, २०२० पछि नेपालको औद्योगिक प्रतिष्ठानको सङ्ख्या ६० हजार १८५ पुगेको जनाएको छ । सर्वेक्षणमा कम्तीमा एउटा सरकारी निकायमा दर्ता भएका उद्यमलाई समावेश गरिएको छ ।"
"""नबिल बैंक र नेपाल बंगलादेश बैंकलाई आगामी साउन १ गतेदेखि एकीकृत कारोबार सुरु गर्न अनुमति दिइएको केन्द्रीय बैंकले जनाएको छ । सोही दिनबाट नेपाल बंगलादेश बैंकका हालका शाखाहरु पनि नबिल बैंकको रुपमा संचालनमा आउनेछन् । यसको अर्थ नबिल बैंकले नेपाल बंगलादेश बैंकको प्राप्ति प्रक्रिया पूरा गरेको छ । नेपाल राष्ट्र बैंकको बैंक तथा वित्तीय संस्था नियमन विभागका अनुसार गत जेठ २९ गते बसेको केन्द्रीय बैंकका पदाधिकारीको बैठकले उक्त एक्विजिसन स्वीकृत गरेको हो । यी दुई बैंकबीच गत जनवरीमा एक्विजिसन सम्झौता भएको थियो । नेपाल बंगलादेश बैंकको १०० कित्ता शेयर अर्को बैंकको ४२ कित्ता बराबर १००:४२ को स्वाप रेसियोमा एक हुने सहमति भएको हो ।""",नबिल बैंक र नेपाल बंगलादेश बैंकलाई जुलाई ११ देखि एकीकृत कारोबार सुरु गर्न अनुमति दिइएको छ भने नेपाल बंगलादेश बैंकका हालका शाखाहरु पनि नबिल बैंकका रुपमा सुरु भएका छन् । केन्द्रीय बैंकले गत जुन २९ मा बसेको बैठकले उक्त एक्विजिसनलाई स्वीकृति दिएको थियो । नेपाल बंगलादेश बैंकको १०० कित्ता र अर्को बैंकको ४२ कित्ता बराबर १०० कित्ता शेयर गरी १००:४२ को स्वाप रेसियोमा एक हुने सहमति भएको हो ।
"""काठमाण्डाै – सरकारले गत वैशाखमा लागू भएका १० विशिष्ट विलासिताका वस्तुको आयातमा लगाइएको प्रतिबन्ध लम्ब्याउने तयारी गरेको छ । सुरुमा सरकारले आर्थिक वर्षको अन्त्यसम्म (असार मसान्तसम्म) निषेधाज्ञा जारी राख्ने घोषणा गरेको थियो । वाणिज्य सचिव गणेशप्रसाद पाण्डेयले मुलुकको आर्थिक अवस्था अझै बलियो नभएकाले यसलाई लम्ब्याउने सोचमा सरकार रहेको जानकारी दिए । आइतबार मन्त्रालयमा भएको बैठकमा पाण्डेले भने, 'हाम्रो ध्यान सबैभन्दा पहिले मुलुकलाई आर्थिक संकटबाट जोगाउने भएकाले विलासिताका वस्तुको आयातमा लगाइएको प्रतिबन्ध लम्बिने सम्भावना छ । प्रतिबन्धले राष्ट्रिय अर्थतन्त्रमा पारेको असरबारे पनि सरकारले अध्ययन गरिरहेको पाण्डेले जानकारी दिए ।  आयातमा प्रतिबन्ध लगाइएका वस्तुहरूको सूची यहाँ दिइएको छ:""",नेपाल सरकारले गत अप्रिलमा लागू गरिएको १० वटा विलासिताका वस्तुको आयातमा लगाइएको प्रतिबन्ध लम्ब्याउने तयारी गरेको छ । वाणिज्य सचिव गणेशप्रसाद पाण्डेयले मुलुकको आर्थिक अवस्था अझै मजबुत नभएकाले निषेधाज्ञा लम्ब्याउन सकिने बताए । सरकारले प्रतिबन्धले राष्ट्रिय अर्थतन्त्रमा पारेको असरबारे पनि अध्ययन गरिरहेको छ । यो प्रतिबन्ध जुलाईको मध्यसम्म जारी रहने अनुमान गरिएको छ ।
"""नेपाल विद्युत् प्राधिकरणले आगामी एक वर्षभित्र काठमाडौँका सबै विद्युत्का पोल हटाउने भएको छ । प्राधिकरणले हाल राजधानीमा भूमिगत विद्युत् लाइन जडान गरिरहेको र करिब छ महिनापछि ओभरहेड ट्रान्समिसन केबल बोक्ने पोल हटाउने काम सुरु गर्ने जनाएको छ ।  अस्तव्यस्त तार भएका पोलहरूले काठमाडौंलाई कुरूप बनाउनुमा प्रायः दोष लगाउने गरेका छन्। प्राधिकरणका कार्यकारी निर्देशक कुलमान घिसिङले ६ महिनादेखि एक वर्षभित्र सबै विद्युत्का पोल हटाउने काम भइरहेको जानकारी दिए । उनले इन्टरनेट सेवा प्रदायकलाई पोलबाट केबल हटाएर भूमिगत फाइबर प्रयोग गर्न समेत आग्रह गरे । 'अन्यथा गम्भीर समस्या आउन सक्छ,' उनले भने।  आइएसपीले प्रयोग गर्ने विद्युत्का पोललगायत सबै विद्युत्का पोल प्राधिकरणको स्वामित्वमा छन् ।""",नेपाल विद्युत् प्राधिकरणले आगामी एक वर्षभित्र काठमाडौँका सबै विद्युत्का पोल हटाउने र भूमिगत लाइनमा जोड दिने भएको छ । प्राधिकरणले ६ महिनापछि ओभरहेड ट्रान्समिसन केबल पनि हटाउने भएको छ । प्राधिकरणले इन्टरनेट सेवा प्रदायकलाई पोलबाट केबल हटाएर त्यसको साटो भूमिगत फाइबर प्रयोग गर्न आग्रह गरिरहेको छ । आइएसपीले प्रयोग गर्ने लगायत सबै विद्युत्का पोल प्राधिकरणको स्वामित्वमा छन् ।
"""नेपाल विद्युत् प्राधिकरणले भारतलाई विद्युत् बिक्री गरी एक महिनामा रु एक अर्ब ७२ करोड आम्दानी गरेको जनाएको छ । प्राधिकरणले जुन २ देखि ३० सम्म इन्डियन इनर्जी एक्सचेन्जलाई प्रतिस्पर्धात्मक दरमा विद्युत् बिक्री गरेर उक्त रकम आर्जन गरेको जनाएको छ । आईईएक्समा हरेक १५ मिनेटमा मूल्य परिवर्तन हुन्छ । यस अवधिमा नेपालले औसत ९ अर्ब ६७ करोड रुपैयाँका दरले १७ करोड ८१ लाख ९१ हजार थान बिक्री गरेको छ । प्रतिइकाई दर सबसे ज्यादा 15 जून (15.93 रुपये) और सबसे कम 21 जून (4.92 रुपये) पर मिला था। त्यस्तै, जेठ २८ गते ७८ लाख १३ हजार कित्ता बिक्री गरी सबैभन्दा बढी ७ करोड २८ लाख २८ हजार रुपैयाँ र सबैभन्दा कम ५६ लाख ७० हजार रुपैयाँ बराबरको ९ लाख ४ हजार ८ सय कित्ता बिक्री गरी नेपालले आम्दानी गरेको छ ।  नेपालले बर्खायाममा भारतलाई विद्युत् बिक्री गर्छ भने सुख्खायाममा विद्युत् आयात गर्छ ।""","नेपाल विद्युत् प्राधिकरणका अनुसार भारतलाई विद्युत् बिक्री गरी नेपालले एक महिनामा रु एक अर्ब ७२ करोड आम्दानी गरेको छ । गत जुन २ देखि ३० सम्म प्रतिस्पर्धात्मक दरमा इन्डियन इनर्जी एक्सचेन्जलाई १७ करोड ८१ लाख ९१ हजार युनिट बिक्री गरेको थियो । 15 जून को सबसे ज्यादा 15.93 रुपये प्रति इकाई दर थी, जबकि सबसे कम 21 जून को 4.92 रुपये प्रति इकाई थी। बर्खायाममा नेपालले भारतलाई विद्युत् बिक्री गर्ने गरेको छ भने सुख्खायाममा विद्युत् आयात गर्ने गरेको छ ।"
"""सरकारले नेपाल आयल निगमको केन्द्रीय कार्यालय भवन धितो राखेर रु तीन अर्ब ऋण लिन गरेको आग्रहलाई स्वीकृत गरेको छ । भारतीय आयल कर्पोरेसन (आइओसी) लाई बक्यौता रकम भुक्तानी गर्न सक्ने गरी राष्ट्रिय वाणिज्य बैंकबाट ऋण लिन सर्वसाधारणको आग्रहलाई अर्थ मन्त्रालयले स्वीकृत गरेको छ ।  स्वीकृतिपछि मन्त्रालयले कर्जा प्रवाह प्रक्रियालाई तीव्रता दिन पनि बैंकलाई निर्देशन दिएको छ ।  यसैबीच मन्त्रालयले निगमलाई बक्यौता रहेको रु पाँच अर्ब तत्काल निकासा गर्ने निर्णय पनि गरेको छ । यसैबीच, वाणिज्य तथा आपूर्तिमन्त्री दिलेन्द्रप्रसाद बडूले निगमको घाटा रकम पनि घट्ने गरी पेट्रोलियम पदार्थमा लगाइएको कर लाई अझै घटाउन अर्थ मन्त्रालयलाई निर्देशन दिएका छन् । असार मसान्तसम्म निगमलाई ४९ अर्ब ५० करोड रुपैयाँ घाटामा छ भने आईओसीलाई २२ अर्ब रुपैयाँ बक्यौता छ ।""",नेपाल आयल निगम (एनओसी) लाई राष्ट्रिय वाणिज्य बैंकबाट इन्डियन आयल कर्पोरेसन (आइओसी) को बक्यौता रकम भुक्तानी गर्न रु तीन अर्ब ऋण लिन सरकारले स्वीकृति दिएको छ । अर्थ मन्त्रालयले ऋण निकासा प्रक्रियालाई तीव्रता दिन बैंकलाई निर्देशन दिँदै निगमलाई तत्काल ५ अर्ब रुपैयाँ निकासा गर्ने निर्णय गरेको छ । वाणिज्य तथा आपूर्तिमन्त्री दिलेन्द्रप्रसाद बडूले निगमको घाटा कम गर्न पेट्रोलियम पदार्थको करमा थप कटौती गर्न आग्रह गरेका छन् ।
"""चालू आर्थिक वर्षको पहिलो ११ महिनामा नेपालमा ३९ अर्ब रुपैयाँ (३१ करोड १० लाख अमेरिकी डलर) बराबरको फोन आयात भएको छ । चालू आर्थिक वर्षमा कूल ५६ लाख ३० हजार फोन आयात भएकामा आठ लाख २७ हजार हाई–एन्ड स्मार्टफोन रहेका छन् । यी फोनको आयातबाट सरकारले ६ अर्ब १७ करोड रुपैयाँ कर संकलन गरेको छ । गत आर्थिक वर्षमा ३४ अर्ब १४ करोड रुपैयाँबराबरको स्मार्टफोन आयात भएको थियो भने ५ अर्ब ४० करोड रुपैयाँभन्दा केही बढी कर संकलन भएको थियो । देशमा आयात हुने फोनको संख्या करिब १० लाखले घटे पनि अन्तर्राष्ट्रिय बजारमा भएको महँगीका कारण देशका जनताले फोनमा थप ५ अर्ब रुपैयाँ खर्च गरेका छन् । देशको विदेशी विनिमय सञ्चितिमा धक्का लाग्नुको कारण पनि यही हो ।""","चालू आर्थिक वर्षको पहिलो ११ महिनामा नेपालले ३९ अर्ब रुपैयाँ (३१ करोड १० लाख अमेरिकी डलर) बराबरको ५६ लाख ३० हजार फोन आयात गरेको छ । यी आयातमध्ये ८ लाख २७ हजार स्मार्टफोनले ओगटेका छन् । सरकारले ६ अर्ब १७ करोड रुपैयाँ कर संकलन गरेको छ । गत आर्थिक वर्षमा ३४ अर्ब १४ करोड स्मार्टफोन आयात गरी ५ अर्ब ४० करोड रुपैयाँ कर संकलन गरेको थियो । अन्तर्राष्ट्रिय बजारको मुद्रास्फीतिका कारण आयातमा कमी आए पनि सर्वसाधारणले फोनमा थप ५ अर्ब रुपैयाँ खर्च गरेका छन्, जसले गर्दा देशको विदेशी विनिमय सञ्चितिमा असर परेको छ ।"
"""काठमाण्डाै – इन्धनको मूल्य वृद्धि गर्ने निर्णय गरेको एक साता नबित्दै नेपाल सरकार फेरि एकपटक मूल्य घटाउन बाध्य भएको छ ।  नेपाल आयल निगमसञ्चालक समितिको शनिबार बसेको बैठकले पेट्रोलको मूल्य प्रतिलिटर २० रुपैयाँ र डिजेल तथा मट्टितेलको मूल्य प्रतिलिटर २९ रुपैयाँ घटाउने निर्णय गरेको निगमले जनाएको छ । यसअघि आज बिहान बसेको सत्तारुढ गठबन्धनका शीर्ष नेताको बैठकले इन्धनको मूल्य वृद्धि गर्ने निर्णय फिर्ता लिन निगमलाई आग्रह गरेको थियो ।  नयाँ मूल्य शनिबार मध्यरातपछि लागू हुने र पेट्रोल र डिजेल/मट्टितेलको प्रतिलिटर क्रमशः रु १७९ र रु १६३ मा उपलब्ध हुने निगमले जनाएको छ ।  आइतबार (जुन १९) मा मात्र सरकारले १७८ र १६५ रुपैयाँबाट क्रमशः १९९ र १९२ रुपैयाँ मूल्य वृद्धि गरेको थियो । उक्त निर्णयको चौतर्फी विरोध भएको थियो ।""",नेपाल आयल निगमको बोर्ड बैठकले पेट्रोलमा प्रतिलिटर २० रुपैयाँ र डिजेल र मट्टितेलमा प्रतिलिटर २९ रुपैयाँ घटाएको हो । सत्तारुढ गठबन्धनका नेताहरूको बैठकले निगमलाई मूल्य वृद्धिमा पुनर्विचार गर्न आग्रह गरेपछि यो निर्णय आएको हो । पेट्रोल र डिजेल/मट्टितेल क्रमशः १७९ र १६३ रुपैयाँमा उपलब्ध हुने गरी नयाँ शुल्क मध्यरातपछि लागू हुनेछ । उक्त निर्णयको चौतर्फी विरोध भएको थियो ।
"""सरकारले हवाई इन्धनको मूल्य वृद्धि गरेपछि नेपालका वायुसेवा कम्पनीहरुले हवाई भाडा बढाउने घोषणा गरेका छन् । नेपाल आयल निगमले हवाई इन्धनको मूल्य प्रतिलिटर १९ रुपैयाँ बढाएको छ । मूल्य वृद्धिसँगै अब काठमाडौंबाट धनगढीका लागि १६ हजार ८ सय ५ रुपैयाँसम्म शुल्क लाग्ने भएको छ । यो हवाई भाडामा ८सय ४० रुपैयाँले वृद्धि हो । मूल्य वृद्धिले सबैभन्दा कम प्रभावित काठमाडौं–सिमरा उडानमा ४ हजार १ सय ९५ रुपैयाँसम्म यात्रु पर्ने अनुमान गरिएको छ । यो रुटमा एयरलाइन्सले १सय ७० रुपैयाँ बढाएका छन् । नयाँ मूल्य सूची –""","सरकारले हवाई इन्धनको मूल्य बढाउने निर्णय गरेसँगै नेपालका वायुसेवा कम्पनीहरुले हवाई भाडा बढाएका छन् । नेपाल आयल निगमले इन्धनको मूल्य प्रतिलिटर १९ रुपैयाँ बढाएको छ, जसका कारण काठमाडौंबाट धनगढी उडानका लागि ८ सय ४० रुपैयाँले बढेर १६ हजार ८ सय ५ रुपैयाँ पुगेको छ । सबैभन्दा कम प्रभावित हुने रुटमा काठमाडौं–सिमरा उडानमा यात्रुको भाडा ४ हजार १ सय ९५ रुपैयाँ पर्नेछ ।"
